{
  "meta": {
    "title": "Signal Room",
    "format": "Short scene",
    "targetRuntime": 8,
    "aspectRatio": "16:9",
    "globalStylePrompt": "Naturalistic near-future drama, restrained contrast, practical fluorescent light, subtle handheld lens character.",
    "globalNegativePrompt": "No glossy futuristic redesign, no holographic interfaces, no added text.",
    "world": {
      "setting": "A worn municipal communications facility during a night shift.",
      "include": "Functional analogue controls, scuffed painted metal, practical cable runs.",
      "reject": "Luxury technology, pristine surfaces, decorative science-fiction lighting."
    }
  },
  "qcChecklist": [
    "Mara's rectangular shoulder patch and short dark hair remain consistent.",
    "Her left hand maintains clear contact with the red handset.",
    "The wall console layout and amber indicator row do not drift between frames.",
    "The handset label remains unreadable rather than becoming invented text.",
    "Mara's spoken line begins only after she raises the handset to her mouth."
  ],
  "characters": [
    {
      "id": "CHAR-MARA",
      "name": "Mara",
      "role": "Night communications operator",
      "block": "Adult operator with short dark hair and a compact, practical silhouette.",
      "visualDescription": "Adult woman in a faded navy utility jacket with a rectangular blank shoulder patch; short dark hair; tired, alert expression; no jewellery.",
      "driftNotes": "Keep the blank rectangular patch, jacket wear, hair length, and practical proportions consistent.",
      "expressions": "Controlled concern, focused listening.",
      "notes": "",
      "audio": {
        "voiceDesignPrompt": "Low, steady adult voice; clipped professional cadence; quiet urgency; clean close-mic recording.",
        "voiceTool": "",
        "voiceNotes": "Record one clean master before adding room coloration in post.",
        "sunoAltPrompt": "",
        "status": "NOT STARTED"
      },
      "continuityStates": [
        {
          "id": "state-default",
          "name": "Default",
          "appliesTo": "",
          "notes": "Dry uniform at the beginning of the shift.",
          "isDefault": true
        }
      ]
    }
  ],
  "locations": [
    {
      "id": "LOC-SIGNAL-ROOM",
      "name": "Signal Room",
      "notes": "",
      "visualDescription": "Narrow municipal control room with a fixed wall console on frame right, painted concrete walls, exposed cable trays, one overhead fluorescent fixture, and a metal desk facing the console.",
      "continuityStates": [
        {
          "id": "state-default",
          "name": "Default",
          "appliesTo": "",
          "notes": "Night-shift practical lighting with the amber console indicators active.",
          "isDefault": true
        }
      ]
    }
  ],
  "props": [
    {
      "id": "PROP-RED-HANDSET",
      "name": "Red Handset",
      "notes": "The label area is blank and must not acquire readable text.",
      "visualDescription": "Heavy red corded handset with a coiled black cable, worn matte plastic, and a small blank recessed label plate.",
      "continuityStates": [
        {
          "id": "state-default",
          "name": "On cradle",
          "appliesTo": "",
          "notes": "Handset begins seated in the wall-console cradle.",
          "isDefault": true
        },
        {
          "id": "state-lifted",
          "name": "Lifted",
          "appliesTo": "During the call",
          "notes": "Handset is in Mara's left hand with the cable hanging toward the console.",
          "isDefault": false
        }
      ]
    }
  ],
  "vehicles": [
    {
      "id": "VEH-MAINTENANCE-CART",
      "name": "Maintenance Cart",
      "notes": "Parked in the rear service aisle; it must not move during the shot.",
      "visualDescription": "Compact municipal electric maintenance cart with a blunt cab, narrow wheelbase, faded cream paint, black rubber bumpers, open rear tool bed, and no readable branding.",
      "continuityStates": [
        {
          "id": "state-default",
          "name": "Parked",
          "appliesTo": "",
          "notes": "Parked in the rear service aisle with the tool bed closed.",
          "isDefault": true
        }
      ]
    }
  ],
  "audio": [
    {
      "id": "VOICE-MARA-CLEAN",
      "name": "Mara clean voice",
      "description": "Canonical clean recording of Mara's restrained professional voice.",
      "notes": "Apply room tone and handset filtering only after the clean master is approved.",
      "cleanMaster": true,
      "sameObjectAs": "",
      "role": "Canonical dialogue master"
    }
  ],
  "scenes": [
    {
      "id": "S01",
      "title": "Unexpected Signal",
      "tier": "A",
      "characters": [
        "CHAR-MARA"
      ],
      "whatHappens": "Mara notices an unexpected indicator, lifts the handset, and answers cautiously.",
      "howItFeels": "Routine work shifts into controlled unease.",
      "notes": "",
      "audio": {
        "music": "",
        "ambience": "Low ventilation hum and distant relay clicks.",
        "notes": "Keep ambience restrained under the dialogue."
      }
    }
  ],
  "shots": [
    {
      "id": "S01-01",
      "scene": "S01",
      "title": "Mara answers",
      "desc": "An amber indicator illuminates; Mara turns, lifts the red handset with her left hand, and answers.",
      "route": "GENERATE",
      "codes": [
        "LOC-SIGNAL-ROOM",
        "PROP-RED-HANDSET",
        "VEH-MAINTENANCE-CART"
      ],
      "characters": [
        "CHAR-MARA"
      ],
      "positioning": "Medium three-quarter view from slightly below eye level. Mara occupies frame left at the desk; the wall console is frame right. Her left hand reaches across to the handset, and the coiled cable remains visibly connected to the console. A compact cream maintenance cart remains parked deep in the rear service aisle.",
      "risks": [
        "Left-hand handset contact",
        "Console geometry drift",
        "Invented text on handset label",
        "Dialogue timing before handset reaches mouth",
        "Maintenance cart silhouette and parked position drift"
      ],
      "safe": "Hold a steadier medium shot as Mara lifts the handset without a camera move.",
      "dur": 8,
      "notes": "",
      "audio": {
        "line": "Signal room. Go ahead.",
        "speakerId": "CHAR-MARA",
        "note": "Begin the line only when the handset reaches her mouth; retain the clean master and add handset filtering in post.",
        "voiceEntityId": "VOICE-MARA-CLEAN",
        "vo": "",
        "sfx": "One soft relay click when the indicator turns on; handset cradle release.",
        "ambience": "Low ventilation hum.",
        "music": "",
        "sync": "Handset reaches mouth before first word."
      },
      "continuityStateSelections": {
        "PROP-RED-HANDSET": "state-lifted",
        "VEH-MAINTENANCE-CART": "state-default"
      },
      "keyframes": [
        {
          "id": "S01-01-A",
          "label": "A",
          "title": "Indicator activates",
          "description": "Mara sits frame left, looking toward the newly lit amber indicator on the frame-right wall console. The red handset is still in its cradle.",
          "notes": "Preserve the narrow room layout and blank handset label.",
          "required": true
        },
        {
          "id": "S01-01-B",
          "label": "B",
          "title": "Handset raised",
          "description": "Mara holds the red handset to her mouth with her left hand; the coiled cable hangs back to the frame-right console; her gaze remains on the indicator row.",
          "notes": "Maintain left-hand contact and the same console geometry.",
          "required": true
        }
      ],
      "clips": [
        {
          "id": "S01-01-M01",
          "label": "A",
          "title": "Turn and answer",
          "dur": 8,
          "kind": "flf",
          "motionPrompt": "The amber indicator illuminates. Mara turns her head first, reaches with her left hand, lifts the handset in one controlled motion, settles it at her mouth, then speaks. Keep the console fixed and the camera nearly still with only subtle handheld movement.",
          "note": "No extra gestures or console changes.",
          "line": "Signal room. Go ahead.",
          "speakerId": "CHAR-MARA",
          "audioNote": "Speech starts after the handset reaches her mouth.",
          "voiceEntityId": "VOICE-MARA-CLEAN",
          "vo": "",
          "sfx": "Relay click and handset release.",
          "ambience": "Low ventilation hum.",
          "fromFrame": "S01-01-A",
          "toFrame": "S01-01-B",
          "emotion": "alert but professional",
          "delivery": "clear and measured",
          "language": "English",
          "pace": "measured",
          "volume": "normal",
          "music": "",
          "sync": "Handset reaches her mouth before speech begins.",
          "motionBrief": {
            "schemaVersion": 1,
            "performance": {
              "action": "Mara turns her head first, reaches with her left hand, lifts the handset, settles it at her mouth, then speaks.",
              "emotion": "alert but professional",
              "delivery": "controlled",
              "facial": "eyes sharpen toward the indicator",
              "gaze": "indicator, then handset",
              "bodyLanguage": "upright and economical",
              "objectInteraction": "left hand lifts the handset and holds it at her mouth",
              "secondaryMotion": "amber indicator illuminates",
              "endingState": "handset held at her mouth",
              "staticConstraints": "console geometry and room layout",
              "prohibitedMotion": "no extra gestures or object morphing"
            },
            "camera": {
              "movement": "nearly locked with subtle handheld movement",
              "timing": "hold throughout",